Tag Line,Location,Asking Price,Cash Flow,Long Description
"$602,500 Amazon Household Furniture Brand (Fully Staffed/Run-For-You)","Los Angeles, CA ","$382,287 ","Cash Flow: $254,857","This FBA (Fulfilled By Amazon)/FBM (Fulfilled By Merchant) Amazon store is one of the most profitable and sustainably long term e-commerce businesses listed on this site.    This is exactly why we have a strict process for evaluating qualified buyers through our team.    We want to make sure we are only speaking to serious buyers.    The owners are extremely busy and we want to be respectful to them, as well as prospective buyers.    So if you're flaky, or need a week to talk to your wife, or aren't liquid enough to do the deal, there is no need to apply (respectfully). It will not be a good use of time for you, or the owners.    We are looking for a buyer who is ready to move with speed (after they verify our business of course).    After you apply, we will send you all of the information upfront. If you still think it's a good fit for you, our team will reach out to schedule a call with you.    If you don't have time to review the basic information when we send it to you, please don't apply.    After you review the basic information, Q&A calls with our team will be reserved for specific questions only, which are not covered in this listing or in our specific info which will be emailed to you.    Please refrain from calling in. Make sure to fill out all your info first in BBS. We will not reach out to anonymous buyers. We've both built and sold off many of our online businesses over the years, and have a very efficient process for selling businesses (including this one). So please be respectful of our process.    This business comes with multiple managers to run the team and day to day operations.    It comes with a total of 15 staff members, including management, mid level, and low level highly trained operators.    As you can see in the pictures, it is doing $602,500 in annual revenue, which averages out to about $50,208 monthly revenue, and about $12,552 weekly revenue.    It is averaging a 42.3% profit margin, which averages out to around $254,857.50 annual profit, around $21,238.13 monthly profit, and around $5,309.53 weekly profit.    We've displayed 1 years worth of revenue screenshots in this listing. You can also see one of the warehouses from our network which are being used for FBM (Fulfilled by Merchant).    The rest of the fulfillment is directly through FBA (Fulfilled by Amazon).    Using hybrid fulfillment models has allowed us to get this Amazon business, and multiple other stores long ahead of the competition, while maintaining sustainability and growth for the long term.    This business is relocatable, and completely remote, even though it is backed by many brick and mortar assets and services which our fulfilled remotely by our vendor network.    The only thing that needs to be added is your information. It will take about 2-5 weeks after purchase (depending on your speed), to transfer all accounts correctly.    After that, this business will run 100% on autopilot, and you will have 24/7 access to view all operations, sales, and profits whenever you'd like on your phone.    This business is buyer ready, and our team is looking forward to speaking with you and answering all your questions, and giving additional details if you're serious.    Please be mindful that we have a lot of interest already, so we need you to follow our processes to complete the acquisition successfully. These processes make it easiest for both the seller (us), and the buyer.    If you're too busy to do due diligence or look over information and reporting correctly, this business is not for you.    If you are just window shopping, this business is not for you.    If you are looking to get an established e-commerce business with a hybrid of online and brick and mortar models that will likely last for several years and produce passive cashflow, and you're ready to move with speed, this is definitely the business for you.    We are looking forward to helping you."
Two for One Technology Business With Established Book Of Business,"Ocala, FL ","$450,000 ","Cash Flow: $125,000","Wiley Holdings inc. is a holdings company that owns 2 Technology Related Businesses.    Wiley Productions LLC: Wiley Productions is a full service Technology Consulting Company with a Book of Business that produces $120,000+ in revenue from Repeat Corporate Clients. The sale includes a Company Vehicle, Tools, Resale Vendor Relationships, Fully Managed Website, Team of Trained Contractors, and Established Corporate Client Relationships. Through Covid, Wiley Productions had a boost in sales as Companies and Churches switched over to a digital platform. Wiley Productions was able to serve by providing Audio Visual upgrades for said businesses. Wiley Productions also provides IT installation and troubleshooting services in both residential and commercial applications. Wiley Productions is completely debt free, did not need to receive PPP funds, and continues to grow its book of business quarterly.    Good Steward Audio Visual (GSAV): GSAV has its roots go back to its previous brand of J&D Media Pros. The untimely death of one of the Managing Partners, forced a brand revision, but the company's book of Business has remained in tact.  GSAV is a full Service Audio Visual Rental Company for both Commercial and Private Events. GSAV has had the Privilege of doing business with companies such as E-One, Florida Blue Cross, Duke Energy, Pike Electric, Governor Desantis, The Villages, The Florida Department of Transportation, and Many others.  Covid-19 did have an impact on sales since the gathering of people was prohibited by the CDC, however since GSAV is completely debt free, its doors remained open through the pandemic. The majority of sales come from repeat corporate and government clients. The sale of GSAV includes an Established book of business and Audio Visual Equipment."
The Entrepreneur’s Source,Available in Multiple Locations ,"$100,000 ",,Empower others to fulfill their dreams – while achieving your own. Be the path forward.
Indoor Digital Billboard Network,"Chattanooga, TN ","$73,500 ",,"Time to be your own boss! Rare opportunity! Low startup cost, fun and simple process to gain accounts with a high income potential.  **Featured as one of the best new business opportunities in America on Larry King's In View Series on Fox Business News.**  Why are we selling?  Owner currently has other obligations that has opened up the opportunity for the right person to step in to an existing business in an exciting industry    Are You Ready to Own Your Own Business?    Build Your Network. Build Your Business. Offering a unique opportunity to own a revenue generating indoor digital billboard network in your local community.  N-Compass TV - provides an exceptional business model where you can start a low cost, exciting home-based business that generates recurring revenue. Explore this proven concept today which is operating successfully across the US and beyond.    About  YOU BUILD YOUR BUSINESS... We provide you with the tools, services ongoing support you need to set up a cash flowing indoor digital billboard network in your community. Or as many available communities as you want to grow into!   This Unique opportunity is special due to a large network of screens being in place upon purchase. Jump right into a revenue generating network!     Why Start an N-Compass TV Business?  Low Entry Level of Investment  Fast-Growing Industry  Multiple Income Streams (Google, Social Media Management, Email Marketing, websites, etc, etc)  Scalable Business Model  No Brick and Mortar  Flexibility to Set Your Own Schedule and Run Your Own Business  Perfect for any Size Community  Hands-On Training and Ongoing Support  Protected/Exclusive Territories Still Available    What We Do for You  Comprehensive Training –You will train directly with our Team Leaders who walk you through every aspect of the business. No guess work or trial and error. We provide you with the industry’s best practices to jumpstart your successful new business.    Ongoing Support - Our US-based team supports you through the life of your business. We are here to help you succeed!    Proprietary Software - We have developed proprietary software, so everything is under one roof. Development upgrades and support.    Content Creation - Our talented team of designers creates everything from your branding materials to the full motion ads that get played on your screens! You will have your own in-house ad agency.    Numbers Don’t Lie  Recall rates are on the decline for other media, while the Digital Signage Industry is moving in the opposite direction…UP!    Ideal Candidate  Our top dealers tend to be outgoing and may have sales, marketing, and/or management experience, and are results oriented. A person who can build relationships and who has the motivation to excel! We do have successful Dealers who work this business part-time but are dedicated to putting in the work. You must be able to get out of your car and talk to people.    Testimonial    ""If it wasn’t for N-Compass, I wouldn’t have the success I’m having...their model made it easy for me to start my own business and see success""  John Ruiz, Hudson/Stillwater, Authorized Dealer    Ready to Dominate Your Neighborhood? Start Today!"
100% Amazon FBA eCom Online Business - Own Popular Brands (TurnKey),"Hatfield, PA ","$2,000,000 ","Cash Flow: $60,000","** Serious inquiries only please.    Business Description    Location Independent - Includes All Inventory - Established    ** Stores are built for you to sell for big $$$, or scale into a long term cash cow with big checks each month    ** Amazon FBA E-commerce store in a popular, high demand business niche.    ** No employees, no headaches - the business takes just couple of weekend hours to run as it's already set up and automated - a feature of Amazon FBA model where all logistics are outsourced to Amazon.    ** Inventory will be included in the sale so the new owner will have no headaches of re-ordering right away.     ** Location independent (can be run from any State, City or Country as long as you have a laptop and wifi access)    ** Domain www and customers email list - all included in the sale as well.  ** 3 month of training and support also included.  ** Amazon seller account included with great reviews on all products.  ** This is a digital asset, training and support 1 month will be done via zoom regular and scheduled zoom calls (but since the business is on autopilot the main action item is to re-order more inventory every so often)  ** The brand is on autopilot so new owner would not need to put in much time to maintain it (unless for growth and scale)  **The business is simple to run and requires 2-4 hours per week to operate.  ** Kindly message me for more detailed info and to receive a preliminary package, brand and products info, supplier's info, links to Amazon store, business model info, financials, etc  ** Upon messaging me, please tell me some more info about yourself as well (example: are you a cash buyer? what is your financing model for the acquisition? do you currently run other Amazon brands or would this be your first?)"
"6 years E-commerce ,Online sales with Patented Product","Baytown, TX ","$180,000 ","Cash Flow: $56,000","We have been selling our patented product the Perfect Draft BBQ Blower for 6 years. The profit margins are Great and the overhead is Low. The products are sold on our E-commerce website, Amazon, Walmart and Ebay. We assemble our products in a 750 sqft. warehouse onsite. We are selling the online business with the Patent and Trademark. This online business can be successfully  from anywhere in the world."
