Tag Line,Location,Asking Price,Cash Flow,Long Description
Millions Possible - The Worlds 1st Patented Fitness Sauna,,"$600,000 "," $600,000","• If you are skilled with selling online - E-COMMERCE    • If you are motivated to help people reach their health, fitness, and anti-aging goals?    This is Gold… a huge opportunity to make a couple million a year doing something you love…    Patented and powerful; Peloton meets incomparable healing infrared FitSauna.  Over 300 videos to train live inside on touchscreen TVs.    This opportunity is to exclusively license the ecommerce in the entire US.  Which includes:  • Proven ecommerce website – generated $1.6 million in 15-months  • Amazon site (new)    As a Retailer of fitness-focused Far Infrared (IR) Saunas there is NO COMPETITION.  We are the only game in town and these products sell extremely well – to both homes and commercial facilities.    License the Patents and two trademarks in the US market.    This product is the world’s first and only patented Far Infrared Heated Health, Fitness and Anti-Aging sauna. With an impressive track record of dramatic growth and incredible profitability, this fully established company has an average order value of $4,894. Generating $1.6 million in its first 15 months of marketing. The current run rate has the website hitting an expected profit of over $900k in the next year.    This promising offering has extensive scale opportunities, such as expanding sales platforms with (many) existing famous (users) influencers, connecting our Amazon account, and other popular options where items like elite fitness and Saunas are regularly ordered online.    Social media has proven to present a huge market outreach, the fitness and wellness benefits are particularly popular on Facebook and Instagram.    This fantastic opportunity has a solid foothold in the evergreen market of health, fitness, and anti-aging. Carrying limitless capabilities along with an appealing line of patented and high-value products, this is an amazing investment for a buyer with connections or skills in ecommerce and logistics.    Far Infrared Heated Saunas (FIR Saunas) are on an explosive trajectory in the US market partially because they uniquely kill viruses and germs while boosting the immune system. This immensely beneficial exercise and detox tool is both unique and booming with increasing popularity.    This growing tech company has an effective, cutting-edge fitness technology with a multitude of benefits including, jumpstarting muscle growth – regardless of age, massively boosting anti-aging and weight loss benefits while stimulating a bonus cardiovascular workout. It makes you burn 600 calories (or more) each ½ hour while watching TV.    Other benefits include the stimulation of your cardiovascular system, boosting your immune system, improving skin appearance, detoxification, elongating endurance and so much more. In addition to its 21 health & fitness benefits, this in-home/commercial gym has proven anti-aging effects along with over 300 streaming training videos, Wi-Fi, and touch screen capabilities.    With effective branding, these fitness systems effectively promote this company’s training and workout videos hosted on the website.    Currently, sells are generated through the website, but adding online marketplaces and affiliates and Amazon.com, etc. is an immediate expansion opportunity. Our product is incredibly popular on social media. With a current streaming presentation of more than 300 training videos, this brand has a solid start. Visibility and promotion of pages on Instagram, Facebook leads to active following and increased revenue. This thriving business is an unparalleled offering within the health, fitness, and wellness industry. A provider of patented at-home and commercial Far Infrared Heated Saunas with Anti-Aging benefits, this is an innovative product with an array of high-value proprietary features.    Easy to manage, grow, and maintain remotely this is an unimaginably promising eCommerce company and an incredible opportunity for a business-minded buyer with ecommerce skills."
Established Store for Sale,"Poughkeepsie, NY","$95,000",n/a,"Established business: Inline Phone Store in the Shopping Center with great walking traffic. Right near the entrance and Macy's. A lot of good stores and restaurants in the mall. Regular customers, Great online reviews, Steady profits and more ways to increase the gross sales."
ESTABLISHED Amazon FBA Store [Inventory Included],"Costa Mesa, CA ","$199,638 "," $78,433","This is a completely turnkey Amazon FBA store that has the building blocks to do $1m + per year.    I started this store back in 2019 with the sole goal of not requiring much of my time. This store only has 17 products, with each of them ranking pretty high (< 25000 BSR) in Amazon’s marketplace. I currently only use ONE supplier who I have worked with from the start. I should also note I paid a company to build this from scratch and set up all the systems and processes and without them I wouldn’t be where I am today.    As of right now I literally only work 2-3 hours per quarter (every 3 months), reordering inventory and reviewing my overall performance. Because I wanted this business to require the least amount of time possible, I made it a priority to only have to order inventory 2-3 times per year.     Don’t get me wrong if you purchase this store, you will have the opportunity to scale this to the next level with the existing relationship I have with that supplier. They literally have made this so easy for me by shipping directly to Amazon’s warehouse, prepping the products and so many other things that go into getting the products ready to sell. They also have a wide range of other products that they have suggested I add to my inventory fleet, but I have decided not to. The reason for that is for me to pay off my student loans and help my family with some bills.    I don’t have a warehouse because I don’t need one. I don’t have any employees because the supplier does 99% of the work. I don’t use any crazy software. I really don’t do anything and this business has consistently grown every single year.    Now you may be asking well why do you want to get rid of it then?    And to be honest, I want to change gears and get into the real estate space. I want to take the money I get from selling this and buy a multifamily building. I’ve always wanted to get into real estate and this is the cash I need in order to do so"
ERP Software with source code and erp portal www.erp.bz for sell,"Santa Barbara, CA ","$500,000 "," $400,000","16 Years old IT Software company from India will sell its entire 100% shares of www.erp.bz domain and ERP Software with source code which is available at demo.erp.bz. This software has been developed in 16 years and used by more than 3100 clients around the world.    We would like to sell the entire 100% share of the company www.erp.bz and ERP Software with source code (https://demo.erp.bz) which has been started in the year 2006 In India. The asking price is without existing clients. If you want the deal with existing clients that also we can consider with a correct price.    We have provided services to more than 3100+ Companies who are using our ERP, Software, and Website globally.    Our company has been founded and registered with the ministry of corporate affairs (MCA) Government of India in the year 2006,    Details of our service  ------------------------  1) Enterprise Resource Planning (ERP) Software (ERP.BZ)    We have started to develop the ERP software called ‘ERP.BZ’ from 2006 itself using ASP.NET C#, WCF, Ms SQL Server to date we are upgrading. This ERP is the fresh & unique solution of modern days ERP Package, Software Developed, Customize and having more than 3100+ clients like  Indian Army,  Steel Authority of India (Steel Club),  Health Ministry of Govt of India (West Bengal),  Manufacturing and Service Sector Private, Public, MSME or Small Company  Isreal Police,  Digital Forensic,    Our ERP has been developed to such a large extent in the last 16 years that this can be used by any of the following industry serving companies:    Manufacturing  Tour and Travels  IT Services  Real Estate  Chemical-Production  Food Processing  Paint-Production Packing  Education  Public Sectors  Infrastructure  FMCG  Financial Services  Media Entertainment  Automobile  Health Industry  Publishing Industry    Our ERP solution has 16 unique modules which can be customized as per the client's requirement. It is web browser-based and can work Online cloud, and offline using the local server. Modules details available at https://demo.erp.bz    ERP Modules  SALES & DISTRIBUTION  PURCHASE - E TENDERING  FINANCE - ACCOUNTS (TAX)  CUSTOMER RELATIONSHIP MANAGEMENT (CRM)  SUPPLY CHAIN MANAGEMENT (SCM)  MANUFACTURING - PRODUCTION - QC  POINT OF SALE (POS)  HR & PAYROLL  SERVICING,  MATERIAL MANAGEMENT - INVENTORY - WAREHOUSE  USER ADMINISTRATION  ORGANISATION HIERARCHY     Please check https://erp.bz and https://demo.erp.bz/ for more details about the ERP software     We also have some B2C website portals like    Property Buy and Sell,  Hotel booking portal,  Dating Portal,  Matrimonial Portal  Job Portal etc  With a regular visitor of around 20000-30000 users per day  (Only Source code also we can sell)    We have more ERP Software for the Given below Industry:    Banking Software  Microfinance (Self Help Group) Management Software  Logistic & Warehouse Management Software  Govt. Municipality Management Software  School-College-University Management Software  Hospital Management Software  (Only Source code also we can sell)    We have a development office in Kolkata & Hyderabad in India and a marketing office in California (USA), London (UK), Dubai (UAE), Capetown (South Africa), and Dhaka (Bangladesh).      For more details about our company, you can see  https://erp.bz  www.vehement.in or www.ilico.in"
"Established Shopify Clothing Brand For Sale. $145,000 Rev. in 2020",Illinois,"$25,000",n/a,"About the Brand Owner    Hey! My name is Yaswanth. Over the past 6 years, I have built multiple businesses. One of my main businesses was the Phi Concept. A clothing brand that I started in high school with my friends. We have built this business for over 6 years and in 2020, the clothing brand went viral and took off. We started shipping 100s of orders per week. In 2021, my real estate business started exploding and I simply had no time to dedicate to the brand which is why I paused it. Now, I am looking to find a good new owner for the clothing brand.    What You Get:  - ALL Designs, Logos, Graphics  - ALL Intelectual Property  - Fully Built and Operational Shopify Store & Website with Over 900,000 Lifetime Website Vistors  - Domain  - Social Media Accounts (TikTok & Instagram)  - Supplier Relationships  - 1-on-1 Coaching on How to Run the Business: I will coach you one-on-one, once a week for 4 weeks, up to 1.5 hours each meeting. I will provide the relationships, introductions & knowledge to succeed with this business.    Instagram  13,000 followers    Tiktok  21,300 followers    Overview    The Phi Concept is a streetwear brand. We come up with ideas and designs that are close to our hearts and share them with the world through clothing. Our core business is to create fun, unique streetwear items and sell them at good prices!    Why Am I Selling?    I have decided to sell this business because I cannot dedicate as much time as I used to be able to. In 2020, both of my businesses started succeeding at the same time. My real estate company grew exponentially and became very profitable, so I had to spend all my time on the real estate company and did not have any other time left to dedicate to my clothing brand. I have to manage employees and hundreds of customers from the real estate business. I am looking to find a new owner for the business because people still ask how they can buy clothing from us, love and miss the brand. I want them to be able to continue purchasing from the brand and enjoy the designs that the brand creates.    Growth Potential    You will have to create new clothing designs (you can pay a graphic designer to do this), order t-shirts/products from the suppliers, and you will have to ship orders to customers who buy from you. Another important part of the business is marketing. You will have to grow the brand by different ways of marketing like we did such as paid advertising, tiktok, youtube etc.!    Why did I start this company?    I am very passionate about design and clothing. I love creating clothing designs, especially streetwear items like hoodies & graphic tees. In 2016, I started this brand in high school and used to see the t-shirts, and hoodies for kids in my high school for $20 each. Later, we decided to open an eCommerce store and we used Shopify to host it. In 2020, I learned about paid advertising on Facebook and Instagram and our brand went viral and we had record-breaking sales compared to previous years. I started this business because it is a personal passion project and people loved the clothing designs that I had ideas for and worked with designers to turn into a reality.    Responsibilities    You will have to create new clothing designs (you can pay a graphic designer to do this), order t-shirts/products from the suppliers, and you will have to ship orders to customers who buy from you. Another important part of the business is marketing. You will have to grow the brand by different ways of marketing like we did such as paid advertising, tiktok, youtube etc.!    Post-Sale / Acquisition Support    I will coach you one-on-one, once a week for 4 weeks, up to 1.5 hours each meeting. I will provide the relationships, introductions & knowledge to succeed with this business. I will also provide recorded training to you so you can learn about the business and provide a book for you to learn about the clothing brand business."
"$2,302,000 Amazon Health Supplements + Vitamins Brand (Fully Staffed)","Miami, FL ","$1,633,269 "," $1,088,846","This FBA (Fulfilled By Amazon)/FBM (Fulfilled By Merchant) Amazon store is one of the most profitable and sustainably long term e-commerce businesses listed on this site.    This is exactly why we have a strict process for evaluating qualified buyers through our team.    We want to make sure we are only speaking to serious buyers.    The owners are extremely busy and we want to be respectful to them, as well as prospective buyers.    So if you're flaky, or need a week to talk to your wife, or aren't liquid enough to do the deal, there is no need to apply (respectfully). It will not be a good use of time for you, or the owners.    We are looking for a buyer who is ready to move with speed (after they verify our business of course).    After you apply, we will send you all of the information upfront. If you still think it's a good fit for you, our team will reach out to schedule a call with you.    If you don't have time to review the basic information when we send it to you, please don't apply.    After you review the basic information, Q&A calls with our team will be reserved for specific questions only, which are not covered in this listing or in our specific info which will be emailed to you.    Please refrain from calling in. Make sure to fill out all your info first in BBS. We will not reach out to anonymous buyers. We've both built and sold off many of our online businesses over the years, and have a very efficient process for selling businesses (including this one). So please be respectful of our process.    This business comes with multiple managers to run the team and day to day operations.    It comes with a total of 13 staff members, including management, mid level, and low level highly trained operators.    As you can see in the pictures, it is doing $2,302,000 in annual revenue, which averages out to about $191,833 monthly revenue, and about $47,958 weekly revenue.    It is averaging a 43.7% profit margin, which averages out to around $1,088,846 annual profit, around $90,737 monthly profit, and around $22,684 weekly profit.    We've displayed 1 years worth of revenue screenshots in this listing. You can also see one of the warehouses from our network which are being used for FBM (Fulfilled by Merchant).    The rest of the fulfillment is directly through FBA (Fulfilled by Amazon).    Using hybrid fulfillment models has allowed us to get this Amazon business, and multiple other stores long ahead of the competition, while maintaining sustainability and growth for the long term.    This business is relocatable, and completely remote, even though it is backed by many brick and mortar assets and services which our fulfilled remotely by our vendor network.    The only thing that needs to be added is your information. It will take about 2-5 weeks after purchase (depending on your speed), to transfer all accounts correctly.    After that, this business will run 100% on autopilot, and you will have 24/7 access to view all operations, sales, and profits whenever you'd like on your phone.    This business is buyer ready, and our team is looking forward to speaking with you and answering all your questions, and giving additional details if you're serious.    Please be mindful that we have a lot of interest already, so we need you to follow our processes to complete the acquisition successfully. These processes make it easiest for both the seller (us), and the buyer.    If you're too busy to do due diligence or look over information and reporting correctly, this business is not for you.    If you are just window shopping, this business is not for you.    If you are looking to get an established e-commerce business with a hybrid of online and brick and mortar models that will likely last for several years and produce passive cashflow, and you're ready to move with speed, this is definitely the business for you.    We are looking forward to helping you."
Techy,Available in Multiple Locations,"$100,000",n/a,"No Experience Needed - ALL TRAINING INCLUDED IN PACKAGE!

If you’re looking for the perfect business opportunity, a TECHY electronics repair franchise could just be the opportunity you need. With a reputation for delivering professional and timely repairs and services, you won’t have to worry anymore about getting your business off the ground. As part of every store package, we assist you in finding the best location for your TECHY store. As an added bonus, we also offer the option to be located inside of a retail giant, Walmart!

With our newest store package, you can now combine 2 dynamite industries with COFFEE & ELECTRONICS in a great new hybrid concept called TECHY CAFE. 

TECHY is officially GLOBAL! We have over 130+ stores and are in 9 different countries."
7 Figure Amazon FBA Store (HANDS-FREE),"Lexington, MA ","$1,799,999 "," $696,035","Let me guess….    If you are on this page you're most likely a high valued entrepreneur looking to acquire a few cash flow producing businesses with the extremely low interest rates (AKA SBA Loans).    Because of that, I’m going to keep this extremely short in hopes that you book a call (where we will go in depth on everything about the store for sale).    To keep this short I want to briefly go over 3 key parts of our strategy.    Our Data + Ai  Why Amazon  Exit    We have acquired/bought decades of ecommerce data that we flush through our custom built AI and machine learning software (built by a data scientist). We use the data to compare against 26 real life ecommerce variables to make sure we always pick the best producing products.    This also enables us to always have our money working at its best ability (aka opportunity cost) at all times.    Which leads me into my next point, which is why AMAZON?    And besides the facts that everyone knows, (biggest ecom retailer, massive growth, biggest company in the united states) Amazon is a massive target market for VC firms looking to get a piece of the pie.    You see these VC firms are leveraging a strategy called “Roll Up Merger”, which is when a VC firm raises capital (100’s of millions) and deploys that capital to acquire as many businesses as possible.    In this case they acquire Amazon FBA stores, merge to one company, then take the company public through an IPO to recoup all their money and some.    And this is the exact reason why we have spent all of our time mastering the game of building, scaling and exiting Amazon FBA stores.    You see the store’s ad, Your viewing right now was a silent partner of ours that wants to sell their store.     We legit built, managed, scaled and prepped this store to be acquired all on the behalf of one of our clients.    If you want to purchase an existing store or have us build one from the ground up, then click the link below to book a call.      When you book you will be sent our white-paper, road map and a few other useful information about the store for sale.    The gross revenues and cash flow is based on the last 3 years of sales from (2018-2021). The sale price will include the $332,950 in inventory that's left over."
Prepare kids for the future with this franchise opportunity!,"Westerville, OH","$99,000",n/a,"Technology is all around us and this business opportunity will help our children be prepared to take on the future!  This online and in-person coding business has unlimited potential income.  Read recent article in Entreprenuer on why this business will continue to skyrocket post-pandemic:  https://www.entrepreneur.com/slideshow/368636    The reason why parents love our establishment is because there is no set curriculum - students (we call them coders) learn at their own pace with individualized attention.  The number of coding languages is unlimited - if a staff member (we call them Code Coaches) knows the language, it can most likely be taught to our coders!  The age range for our coders is 7 - 18.    As an owner, you do not need to have coding experience and can run this on your own or hire someone to do it for you.  Primary responsibilities include marketing/recruiting new students, monitoring and signing in students and coaches over Zoom, scheduling sessions with the coders/coaches, hiring/HR activities, running payroll and some light cleaning at the school.    We used to only offer on-site learning and built our space to accommodate our coders and Code Coaches to have a great learning experience.  Our space in Westerville is amazing and one-of-kind!  With a foozball table, work space for team projects/summer camps, white boards throughout, several flat screen TVs, small pantry for conveniences of birthday parties and customer appreciation nights, an office and a small room for those that need more focus on their lesson...there's no doubt our coders and Code Coaches love our space!    Asking price for this established business is $99k.  There is already an established number of clients for this business.  Owners will provide high level training of business processes and will assist in transition.      Interested to learn more about this opportunity? Please call 614.598.1388 and mention listing on bizbuysell.  Serious inquiries only please."
2 Metro By T-Mobile Stores For Sale,"Hamtramck, MI","$150,000",n/a,"This is your opportunity to join the fastest growing cellular company. These location have been operating under the same franchise for over 8 years. Both locations are located on the busiest corners in the city of Hamtramck. City of Hamtramck is a 2.1 mile radius that houses over 22,000 individuals. There is plenty of potential in this business, both locations are employee ran. Net income is between $18,000-$20,000. The asking price is for BOTH locations."
Shop-Talk Cad/Cam Software. Established in 1988,"Houston, TX","$500,000",n/a,"Shop-Talk Cad/Cam founded in 1988,  when I created a CNC CAM Editor, lathe and mill, tool-verification back plotters and communications program to solve the need for an easy-to-use, inexpensive PC-based programming system.    Shop-Talk was the result of that need and has developed into a complete CAD/CAM system for programming CNC Lathes and Mills using a conversational programming technology for machinist."
2 Kiosks In A Shopping Mall,"Huntington Station, NY","$110,000",n/a,"Established business: 2 Kiosks in the busy Shopping Center with great walking traffic. The stores in the mall: APPLE, MACY’s, Bloomingdale's, ZARA and others, plus a few restaurants. Regular customers, steady profits and more ways to increase the gross sales."
