Tag Line,Location,Asking Price,Cash Flow,Long Description
Profitable Software/Marketplace Online Ordering for Restaurants,Virginia ,"$650,000 ",,"A Shopify for Restaurants, established, profitable SaaS (software as a service) marketplace ordering platform that provides a website/online ordering to restaurants to lower ordering costs from the big portals (grubhub / doordash etc.) who charge 20/30% per order.  This business is built with multiple revenue streams in mind. This is a 100% virtual/remote business that can be run from anywhere with no inventory, location needed.    Business revenue is very stable (from existing customers) even though no active marketing in place. Churn is very low as well & we have customers with us for more than 7/8 years. Many things are automated & business requires about 10 hours a week to manage in current state although investing more time will significantly improve/grow things. Restaurant owners have admin access that allows them to make updates/changes to their own website without much need from us. Additionally use a remote agent to help answer tickets. So for the most part everything is automated & require very little time to maintain.    There are numerous other growth opportunities available and I can discuss with the new owner.  The growth opportunity exists both in increasing the overall customers and internally growing the customer value of existing customers. There is also a constant demand for new features that would be very profitable and increase the overall pricing of the software."
"BUY/SELL/TRADE - Electronics Repair Business- Oldsmar, FL","Oldsmar, FL ","$150,000 ",,"If you’re looking for the perfect business opportunity, a TECHY electronics repair franchise could just be the opportunity you need. With a reputation for delivering professional and timely repairs and services, you won’t have to worry anymore about getting your business off the ground. We now have over 130+ stores and are GLOBAL in 9 different countries."
"TECHY CAFE - Electronics Repair & Cafe shop- San Antonio,TX","San Antonio, TX ","$195,000 ",,"If you’re looking for the perfect business opportunity, a TECHY CAFE electronics repair franchise could just be the opportunity you need. With a reputation for delivering professional and timely repairs and services, you won’t have to worry anymore about getting your business off the ground. Now you can also combine 2 dynamite industries with COFFEE & ELECTRONICS in a great new hybrid concept. We now have over 130+ stores and are GLOBAL in 9 different countries."
"Baby Feeding Essentials- Featured in Good Morning America-$70,000","Brooklyn, NY ","$70,000 ","Cash Flow: $64,000","$24,000 inventory included in the asking price.    Teal Meal started in November 2020. It was created with parents in mind to offer simple, high-quality, eco-friendly products that felt good to use. Additionally, the biggest differentiator of Teal Meal is the mission behind it which serves as a strong foundation of what this business stands for.     Although a young brand in the market, Teal Meal started to get recognized early on by the incredible opportunity to be scouted and featured by the largest television show and broadcast in the United States, Good Morning America on ABC.     It was an experience that helped amplify the voice of Teal Meal by being shown in front of millions of viewers, as well as it helped us create incredible connections with which we have the best relationships that can be used again in the near future. Along with the forementioned, Teal Meal was also featured by a local news channel in Brooklyn, New York – News12, and won the Good Housekeeping's 2022 Parenting Awards, a magazine with over 17 million readers.     Apart from this, different influencers that have a large platform on social media have also loved and shared our products with their audience (influencers ranging from an Instagram follower count from 150,000 up to 3,400,000 with a high engagement rate).     Teal Meal is a trademarked business in the US.    Being eco-friendly and sustainable is the focus today for every parent and this trend will continue to grow as we become more aware of the impact our consumer behavior has. Teal Meal is at the forefront of this incredible mission, and there is so much more potential that this business has to continue to grow and to consolidate its position in the baby niche market.     With the right new management, having all the structures needed to succeed, and continuing to enforce the mission for which the parents are trusting the brand, it will certainly reach and exceed its potential."
$21k+/m profit. Easy to manage DTC Ecommerce Brand. Turn Key Setup.,"Fort Lauderdale, FL ","$380,000 ","Cash Flow: $253,736","Key Features:          Last 12 months $800k+ in Revenue and $250k+ in Net Profit (July 21 - June 22)        2 year old business/Brand selling unique hand forged culinary knives        Reputable Brand on a clear path of scalability        Highly profitable and easy to manage        A to Z turnkey logistical setup will be included        Easy fulfillment to over 30 countries        Inventory wholesale value of over $25,000 included        Over 25% net margin / about $20,000/month in profit        Industry leader with continuous growth        AOV (Average Order Value) of $160+        12% returning customer rate with potential to be much higher        Over 17,000 email subscribers        Evergreen niche in a rapidly growing industry        Over 20 SKU’s that have been branded with lots of product expansion potential to scale the business        Archive of over 2000 high quality Professional photos and videos + hundreds of User generated content        Archive of written blog content        Social media accounts included – Facebook: over 15k followers – IG: over 19k Organic        Great Facebook Feedback Rating        30 day support will be included to walk the buyer through every step of managing and operating the business        Library of over 20+ ads that have been successful in the past        Facebook Pixel will be included in sale (Extremely valuable)        Operating team of subcontracted and full-time employees will be included    Why am I selling?    I’ve shifted my attention in the past few months to other endeavors. The brand should be in the hands of someone that is willing to aggressively scale the business to its full potential. The brand is on a clear path of success and scalability.    The business has strong gross profit margins however there are significant efficiencies to be gained in operations and better use of marketing spend.    What are your main marketing methods?    We run our own Facebook/Instagram, tiktok ads and have an agency who works on our Google, Bing and Youtube ads. We also consistently publish SEO optimized blog articles. We also post on our Instagram and Facebook pages which has allowed us to grow an organic following of 15k followers on Facebook and 19k on Instagram.    What are your expenses?    Most of our expenses are marketing costs which are mostly spent on Facebook and Google. We also outsource tasks like Email Marketing, Copywriting, Graphic design, and google ads. Here’s a general list:    -       Ad costs (Facebook, Instagram, Google, Bing and Youtube)    -       COGS ( cost of goods sold) + Shipping    -       Outsourced tasks + 1 full time employee    -       Shopify fees + apps used    -       Miscellaneous software (Email, attribution, customer service, affiliate management, SMS marketing)    -       Payment processing fees (Shop Pay, Paypal, Stripe, Afterpay)    How much time do you spend on your business?    The founder spends about 10-15 hours per week managing and operating the business. We have one full time employee right now which spends about 30 hours per week doing customer service and logistics management.    Anything else we should know?    This is a great, unique, and extremely profitable business. The stage has been set to allow the buyer to scale the brand to new heights."
CMIT Solutions,Available in Multiple Locations ,"$150,000 ",,"We’re a tribe of small business owners working together to make other business owners successful. CMIT helps businesses increase their profits by making technology work for them, not against them."
Metro by T-Mobile Authorized Dealer - 6 Locations!,"Indianapolis, IN ","$385,000 ","Cash Flow: $278,711","Profitable, locally-owned and managed wireless dealer organization (for Metro by T-Mobile) in a busy market.  Organization owns 6 locations and has been in business for 10+ years and is a sub dealer for a major national master dealer.    Services and products sold include:  -Phones, tablets, and home internet  -Wireless services  -Protective cases and tempered glass  -Charging accessories, bluetooth/audio      The market is operated by 16 mobile experts and 2 area leads."
Telecom Company,"Wayzata, MN ","$450,000 ",,"CR Communications is a business that specializes in communication services. Located in the Minneapolis/St. Paul, MN area. We plan to provide the best telecommunication solutions and analyze the individual needs of our customers. Our goal is to become the leaders in this market. We will accomplish this by building a rapport and credibility with our clients, offering them reliable services and a quality product."
"Turnkey CBD Biz: Extraction Equipment, E-Com, Established CBD Brand",North Carolina ,"$395,000 ","Cash Flow: $50,000","Have you ever thought of owning your own brand or want to create CBD? The hard work has been done here for you - it is yours to grow at this point. With the purchase of this business you will ""own the gold"" and have the ability to make your own CBD and sell that CBD on an already SEO-established and well running e-commerce site. The brand has been grown over the last two years into a reputable 5-star Google (40+) recommended e-commerce site complete with Instagram and Facebook presence. We also include for sale thousands of customers on our established and opted-in mailing list.    There are numerous aspects to the sale of this business and numerous income streams available immediately to you:  1. Retail sales of the CBD online (established and SEO friendly online brand)with many repeat customers. Plug-n-play revenue with the deposits just hitting your account daily.  2. Production of the product with the lab equipment being sold - ""own the gold"" to have the best margins possible.  3. Wholesale and white label sales with existing customer streams.  4. Extraction jobs - producing crude CBD or end product for other companies.    The sale of this business includes all the lab equipment you will need to make high quality CBD products. We are including training to take even a novice to a high level CBD maker. After production of the CBD we also include training on the equipment and knowledge on bottling and packaging (including making your own high quality bottle labels with the commercial label printer included) to posting the CBD for sale online on the already established Wordpress and WooCommerce website.    The owner of this business can purchase hemp on the market, or grow it themselves and from there on out own the entire process from the Farm to the Bottle. The brand is established with products that that market loves including different flavors and strengths of CBD oils, topical creams, gel capsules, and pet CBD. The market potential for CBD is huge and growing.     The owner can work as much or as little you wish. Making CBD does not have to be a burden once you learn how to do it. The extractor can be run as little as you want, all the way to 24 hours a day for max production and ROI. A little bit of hemp goes a long way in the extractor and can produce a lot of crude CBD that can be used to make oils, topicals, vapes, and more.    Contact us for more information."
Rapidly Growing SAAS FinTech Lending Software,Wisconsin ,"$500,000 ","Cash Flow: $110,000","The FinTech has bank customers, distribution contracts , $150k in gross revenue plus over $190k in proposals that are in the hands of potential customers.  Clear path for ongoing and rapid growth.      This company provides financial institutions with next generation customer focused digital lending software.  The software is cloud-based and provides guided online applications and automated document collection giving customers 24/7 access to applying for loans.  This system modernizes financial institutions lending and leads to more loans that are closed faster.  Banks need to evolve to this type of lending to compete with online lenders.     One entrepreneur owner who is more of a product designer than a CEO.  He would like to stay involved in some capacity to help continue the current growth trajectory."
Thriving Advertising and Public Relations firm for sale,"Bellevue, WA ","$1,950,000 ","Cash Flow: $2,909,323","25 year old established Northwest Public Relations and Digital Marketing firm with a solid and established online footprint for sale.    Company is the leader in the industry and dominates Google and Bing within 1000 miles and is an absolute cash cow with multiple revenue streams and methodologies.     Included in the sale are a slew of internet assets, methodologies, and procedures used by the owner that are worth more than the asking price.  Company is a one man operation that runs with remove workers/contractors and has grown 29% the last two years.    Owner must sell for reasons he will share with the buyer. Cash out only."
"Car Dealer + Online sales, $6 million revenues, asking 2X EBITDA!","Clark County, NV ","$800,000 ",,"Rare opportunity. Dissolving partnership to pursue other business interests out of state. Established, growing and profitable car dealership with significant online sales. Excellent reputation. Optional 5,000 square foot office building with additional 2 acre inventory lot in prime Las Vegas location can be leased or bought with the business."
"TECHY CAFE - Electronics Repair & Cafe shop - Pinellas Park, FL","Pinellas Park, FL ","$195,000 ",,"If you’re looking for the perfect business opportunity, a TECHY electronics repair franchise could just be the opportunity you need. With a reputation for delivering professional and timely repairs and services, you won’t have to worry anymore about getting your business off the ground. We now have over 130+ stores and are GLOBAL in 9 different countries."
"BUY/SELL/TRADE- Electronics Repair & Retail Store- Deerfield Beach, FL","Deerfield Beach, FL ","$110,000 ",,"If you’re looking for the perfect business opportunity, a TECHY electronics repair franchise could just be the opportunity you need. With a reputation for delivering professional and timely repairs and services, you won’t have to worry anymore about getting your business off the ground. We now have over 130+ stores and are GLOBAL in 9 different countries."
Amazon FBA Wholesale Brand,Florida ,"$30,000 ","Cash Flow: $250,000","Fulfillment by Amazon (FBA) is a service that helps businesses grow by providing access to Amazon's logistics network. Businesses send products to Amazon fulfillment centers and when a customer makes a purchase, we handle receiving, packing, shipping, customer service, and returns for those orders. Effective, reliable ecommerce fulfillment delights customers.    You sell it, we ship it. Amazon has one of the most advanced fulfillment networks in the world. With Fulfillment by Amazon (FBA), you store your products in Amazon's fulfillment centers, and we pick, pack, ship, and provide customer service for these products. FBA can help you scale your business and reach more customers.    All the infrastructure is already built out, including but not limited to:  - Managers & Operation Staff all inhouse not outsourced overseas  - Wholesale Suppliers & Authorized Product Sourcing  - Product Data Research Team  - Retail Arbitrage Product Souring Team  - Tactical Arbitrage Product Souring Team  - Online Arbitrage Product Souring Team  - Wholesale Product Sourcing Team  - Warehouse In Orlando Florida  - Logistics & Fulfillment Team  - Copywriting, Listing, & Photography Team  - 24/7 Customer Support Team    This startup is buyer ready for $50,000"
Unique Photography Product ~ over $45k inventory ~ shopify store,,"$17,500 ",,"This is an exciting opportunity for someone who is skilled at product marketing. Walk right in to a ready-to-go business opportunity.  Meet Omazeballs, a unique photography prop featuring a flawless K9 crystal ball kit.  Omazeballs allows for fascinating photography using your phone or digital camera. Shopify Store is designed and launched, product is approved on Amazon, registered Trademark and brand is established and approximately 950 kits are included that would retail over $45,000. Website is omazeballs.com and social profiles on Instagram, Facebook and Tiktok are included.  The business is launched but needs the marketing to get it off the ground.  I will work with buyer to transfer product inventory to your location.  Each kit retails for $48. This is a visual product and would be a perfect business for anyone who has instagram marketing experience.  Instagram ads would be a perfect place to optimize returns.  I have spent 2 years building this brand and sourcing product but need to sell because my time is needed in my other businesses.    What is the product?  Omazeballs are refined in size at 80mm to provide the greatest quality image, allowing you to capture unforgettable moments. This magical crystal ball may be used with either a smartphone or a professional camera. You will experience OMAZING creativity no matter how you take the shot! A handy tool to take anywhere you go.     Omazeballs are designed with quality standards that a professional photographer requires at a price that everyone can afford. Whether you are a professional photographer with a DSLR camera or an amateur with a mobile phone camera...easily create stunning composed shots utilizing Omazeballs as a jaw dropping prop.    AN ENTIRE KIT    The Omazeballs Pro Photography Kit includes everything you need to unleash your photographic creativity out of the box. No upgrades needed here!  • K9 Crystal Ball ($58 value)  • Velvet Lined Neoporene Bag ($26 value)  • Square Crystal Stand ($16 value)  • Silicone Display Stand ($8 value)  • Microfiber Cleaning Cloth ($8 value)    You can look the product up on Amazon or on the website to view more about it and what it is used for.      Have questions? Let's talk! Call or send me a message."
Eminent Ecom,Available Nationwide ,"$50,000 ",,"Eminent Ecom is a Automated Amazon FBA Store that offers a TURN KEY, profitable e-commerce online business utilizing AMAZON FBA & comes with a 150% ROI GUARANTEE"
Information Technology Training Center For Sale,"Lauderhill, FL ","$100,000 ",,Information Technology school and training center for sale in Fort Lauderdale area
"Powerful Supplement Site - Brain Health, & Body Restoration",,"$785,000 ","Cash Flow: $166,657","Very well priced dynamic Internet company operating in the wellness space.    Break into a very closed industry when you buy this ongoing successful internet supplement provider.    If you are interested in an e-commerce business with immediate upside and double-digit growth potential, then we need to talk.    This fast-growing wellness care business continues to increase every single year over year and this is without an aggressive marketing/advertising program.    The new owner will be able to increase gross sales by leveraging this company's existing email list along with the addition of social media focus and some targeted ad spending. Growing the ad and PR presence will return handsomely for the new owner. The seller will reveal the blueprint that will rapidly increase profits."
"At Home Business - Amazon, Walmart FBA Personalized eCommerce Brand","New Smyrna Beach, FL ","$199,000 ","Cash Flow: $220,000","- All products have been designed and created by Brand Owners and are brand registered.   - Amazon, Walmart, Ebay, Etsy, www. Many Streams of Income that are scalable.  - Unique Molds - Proprietary only to this brand - No one else can sell them. Brand Exclusivity.   - Established Listings with high stars.   - Listings with Professional Videos  - Product Line Ranges from Trendy Products Kids Toys, Sun Hats, Beauty Supplies, to Headbands that sell all year long.  - The Brand - Has been created and has a 12 year track history of successful products.  - Products have been created for year round sales and holiday sales.   - Trending products popular and unique   - The brand has all amazing private label trending products that ships directly to Amazon so all is streamlined. Some examples in video below. All exclusive to this Brand Only.   - The brand is artfully and tastefully designed and thus gained good traction with Amazon / Walmart customers who appreciate luxury designs and premium products  - Domain www and Contacts For Ordering The Brands Turn Key Products- all included in the sale as well.  - Amazon seller account included with great reviews on all products.  - Walmart seller account included with great reviews on all products.   - Ebay seller account   - Etsy seller account  - www. site   - Instagram Account with Large following  - 2 month of training and support also included.  - This is a digital asset, training and support 2 months will be done via zoom regular and scheduled zoom calls (but since the business is on autopilot the main action item is to re-order more inventory every so often)  - The brand is on autopilot so new owner would not need to put in much time to maintain it (unless for growth and scale)  - The business is simple to run and requires 2-4 hours per week to operate.   - Some orders from Walmart are shipped merchant fulfilled, but can be shipped into Walmart for them to fulfill.   - Amazon FBA E-commerce store in a popular, high demand business niche.  - All Products were made from scratch from beginning to end packaging. Not Sold to any other Business. Independently sold from Merchant to Customer Creating a bigger profit margin.   - Location independent (can be run from any State, City or Country as long as you have a laptop and wifi access)  - No employees, no headaches - 4 online representatives that help with managing Amazon ACOS, Walmart, Reviews, and Graphics if needed.  the business takes just couple of hours to run as it's already set up and automated - a feature of Amazon FBA model where all logistics are outsourced to Amazon.  - Inventory will be included in the sale so the new owner will have no headaches of re-ordering right away.  - All Proprietary Photos and Videos will be included.   - Over 200 SKU's  - Kindly message me for more detailed info, brand and products info, supplier's info, links to Amazon store, business model info, financials, etc  - Upon messaging me, please tell me some more info about yourself as well (example: are you a cash buyer with liquid funds so you're able to close on the acquisition if everything matches your criteria? also, do you currently run other Amazon brands , Walmart, or would this be your first?)  - Serious inquiries only please. Thank you.    A broad range of opportunities is open to the brand: product expansion, new eCommerce marketplaces, wholesale market expansion, and harnessing social media and influencer marketing. Sites like Pinterest, TikTok, and Instagram are hugely influential in the gift and special occasions niche, and a strategic campaign would likely show excellent ROI. Introducing an affiliate program with influencer marketing and partnerships would make a great addition."
